{"schemaVersion":1,"kind":"site","site":"blog-site","domain":"blog-site","verdict":"CRITICAL","exitCode":2,"checkedAt":"2026-09-20T22:32:00Z","durationMs":1730,"degraded":true,"acknowledged":["https-forced"],"checks":[{"checkId":"creds","state":"fail","code":"tool.creds-unauthorized","tier":"none","detail":"Cloudflare token not found; GitHub token read from the keyring","checkedAt":"2026-09-20T22:28:00Z","fix":{"summary":"Create a new token, then run `cairn auth set` naming the credential.","actor":"operator","outward":false}},{"checkId":"delegation","state":"pass","tier":"none","detail":"nameservers match the zone","checkedAt":"2026-09-20T22:28:00Z"},{"checkId":"deploy","state":"fail","code":"tool.deploy-build-failed","tier":"none","detail":"build failed 26m ago (3f0ba18), main is 2 commits ahead","checkedAt":"2026-09-20T22:28:00Z","fix":{"summary":"Read the build log in the Cloudflare dashboard, then push a fix.","actor":"developer","outward":true}},{"checkId":"email","state":"skip","reason":"reason.cred-missing","tier":"none","checkedAt":"2026-09-20T22:28:00Z","fix":{"summary":"Run `cairn auth set` naming each missing token, then run the command again.","actor":"operator","outward":false}},{"checkId":"engine","state":"fail","code":"tool.engine-behind","tier":"none","detail":"0.71.0 installed, 0.78.0 latest, 7 releases behind","checkedAt":"2026-09-20T22:28:00Z","observed":{"installedVersion":{"value":"0.71.0","source":"github"}},"fix":{"summary":"Raise the @glw907/cairn-cms range in package.json, then deploy again.","actor":"developer","outward":true}},{"checkId":"errors","state":"skip","reason":"reason.cred-missing","tier":"none","checkedAt":"2026-09-20T22:28:00Z","fix":{"summary":"Run `cairn auth set` naming each missing token, then run the command again.","actor":"operator","outward":false}},{"checkId":"https-forced","state":"held","condition":"edge.https-not-forced","tier":"none","detail":"Always Use HTTPS is off for the zone","checkedAt":"2026-09-20T22:28:00Z","fix":{"summary":"Turn on Always Use HTTPS for the zone under SSL/TLS, Edge Certificates.","url":"https://cairn.pub/docs/admin/is-it-working#force-https-at-the-edge","actor":"operator","outward":true},"hold":{"until":"2026-09-25T22:32:00Z","expired":false}},{"checkId":"publish-path","state":"pass","tier":"none","detail":"App installed, branch writable","checkedAt":"2026-09-20T22:28:00Z"},{"checkId":"serving","state":"pass","tier":"none","detail":"200 in 132ms","checkedAt":"2026-09-20T22:28:00Z"}]}
